id,text,stereotype,vilification,dehumanization,extreme_language,lack_of_empathy,invalidation,text_masked
eng_6d05a10228b4a6ef6cd3445be431986b,"WFP Armenia Country Brief, November 2024 Refugees",0,0,0,0,0,0,"WFP Armenia Country Brief, November 2024 Refugees"
eng_cab02e0698cc8dcec161628a7cc2729f,Zelensky to Meet With Leaders to Discuss Ukraines Future,0,0,0,0,0,0,Zelensky to Meet With Leaders to Discuss Ukraines Future
eng_bbb0857008057d5fcb0e6b4b6315a0e1,Capitalism is not capitalism communism is not communism and bitcoin not shitcoin,0,1,0,1,1,1,Capitalism is not capitalism communism is not communism and bitcoin not shitcoin
eng_b3bf07c898fbecb07f8395a569e674ee,Doesnt she believe in open borders?,0,0,0,0,0,0,Doesnt she believe in open borders?
eng_e4f2815312bca17a20435390e50983b4,Heres why the Democrats didnt come to McCarthys rescueWinstonSalem,0,0,0,0,0,0,Heres why the Democrats didnt come to McCarthys rescueWinstonSalem
eng_9b8b71a0aaa4c75bb1c691b448859741,Helpful to see the difference between economic sanctions against Russia v traditional sanctions,0,0,0,0,0,0,Helpful to see the difference between economic sanctions against Russia v traditional sanctions
eng_8366a8bf523356b1329f0bd1dbb1ee0a,WAS THERE A CEASEFIRE DURING WWI TO HUNT WOLVES! Yes..,0,0,0,0,0,0,WAS THERE A CEASEFIRE DURING WWI TO HUNT WOLVES! Yes..
eng_6d9b9237c730945828f90f02e5ad428a,Judge in Donald Trump's NY Fraud Case Rebuffs Request,0,0,0,0,0,0,Judge in Donald Trump's NY Fraud Case Rebuffs Request
eng_49d033b554865ae55ba65d500ddfb2c1,Can Trumpism be defeated? Absolutely. Heres how Bernie Sanders,0,0,0,1,0,1,Can MASKED_TOKEN be defeated? Absolutely. Heres how Bernie Sanders
eng_be35896ded4f7672dfb6cc93e5621383,this is what we got for a stolen election.,0,0,0,1,0,1,this is what we got for a MASKED_TOKEN election.
eng_8a1364327af033690b18da47fda65de8,Another Paper Ballot Election in Pivotal Swing States,0,0,0,0,0,0,Another Paper Ballot Election in Pivotal Swing States
eng_ba3420871f1d9f55c1ee48381744ed6a,Not when it comes to the radical left.,1,1,1,1,0,0,Not when it comes to MASKED_TOKEN MASKED_TOKEN.
eng_6815d71d128500b9c1fad80f07866288,Can Canada foster the blue states for four years with an option for adoption based on the next presidential election?,1,0,0,1,0,1,Can Canada foster the blue states for four years with an option for adoption based on the next presidential election?
eng_eb195f45bb3a7feb3ea6cf369944fed8,Wait until H5N1 hits red states.,0,0,0,1,1,0,Wait until H5N1 hits red states.
eng_fa9bc3abcb09acbebf193d33593e9cba,Thanks for the history refresher. The map linked is of the last 20 years of NATO expansion. Thx again.,0,0,0,0,0,0,Thanks for the history refresher. The map linked is of the last 20 years of NATO expansion. Thx again.
eng_db3a8af16f9017b81cfeadb7935f7519,ASU Jewish Studies gives context to IsraeliPalestinian,0,0,0,0,0,0,ASU Jewish Studies gives context to IsraeliPalestinian
eng_10aca86468082ea9dbe0b785c1598731,States trying to remove Donald Trump from the ballot,0,0,0,0,0,0,States trying to remove Donald Trump from the ballot
eng_7a99e0935cb0f4601430cfd0a3d50114,The to congressional Democrats rn,0,0,0,0,0,0,The to congressional Democrats rn
eng_e156db92c33a443356b1c4dbc631d742,"Donald Trump bashes Biden, DeSantis during Erie PA",0,0,0,0,0,0,"Donald Trump bashes Biden, DeSantis during Erie PA"
eng_fce4da5e930b16be7aa2d17d138293b9,Can we believe anything the IDF says?,0,1,1,0,0,1,Can we believe anything the IDF says?
eng_5864c188c60c6a71a488f46b6b5ae3c0,Mitch can redeem himself by organizing insurrection that draws people from every corner of the country to take back the government.,0,1,0,1,0,1,Mitch can redeem himself by organizing insurrection that draws people from every corner of the country to take back the government.
eng_4657aaf1e95ef1ef3cdf6a9386892013,Senate Democrats decry unethical insulin costs,0,0,0,0,0,0,Senate Democrats decry unethical insulin costs
eng_9dc9ade4fef968aef0090a69c1b56e92,Now Iowa Republicans care Trumps lies,1,1,1,1,0,0,Now Iowa Republicans MASKED_TOKEN Trumps lies
eng_6babc91ac4611dc4a63523971aa72069,Does Nigeria immigration issue visa?,0,0,0,0,0,0,Does Nigeria immigration issue visa?
eng_4706655a581b7e119709ade14a53ef81,And they will call it election interference and demand congressional hearings.,1,0,1,0,0,1,And they will call it election interference and demand congressional hearings.
eng_5da3fb51a87bd3b4129af8ad9e8ca574,I just signed a petition Investigate X and Elon Musk for election interference. Sign here leadnow.cacampaignsel...,0,1,1,0,0,0,I just signed a petition Investigate X and Elon Musk for election interference. Sign here leadnow.cacampaignsel...
eng_97672cfe71eaf6138575b1ca8a4824f7,"Bloop ""No thanks White South Africans turn down Trumps immigration offer"" @URL",0,0,0,0,0,0,"Bloop ""No thanks MASKED_TOKEN South Africans turn down Trumps immigration offer"" @URL"
eng_0efb292c4714758adb1d9c09f4da6475,Donald Trump stops at Front Street Brewery,0,0,0,0,0,0,Donald Trump stops at Front Street Brewery
eng_804a9bc38f0be88807df0d0ef4a36466,Not long now until resistance movement slows down fascism. Just a few more follows,0,0,0,1,0,0,Not long now until resistance movement slows down fascism. Just a few more follows
eng_f50aa052618c8ca974f5d8ca22762bf2,Deleted Facebook account. If I wanted fake news I would sign up for x. On Threads and Bluesky now. Im hoping more will follow.,0,0,0,0,0,0,Deleted Facebook account. If I wanted fake news I would sign up for x. On Threads and Bluesky now. Im hoping more will follow.
eng_db607ce17c6337a53b97573b01100a12,"""snowflake, sjw, woke"" what if i bash my head against the wall",1,1,0,1,0,0,"""snowflake, sjw, MASKED_TOKEN"" what if i bash my head against the wall"
eng_68b70582e464fd04e82742f23dcafbc2,Crazy how consistently theorycels feed the liberal agenda their analyses are so adept at dismantling,1,0,1,0,0,1,Crazy how consistently theorycels feed the MASKED_TOKEN their analyses are so adept at dismantling
eng_a1468e6eb79d8cbf1977d581eda59f49,"Dont get too complacent caz it sey inna di Gaza one gone, another one VybzKartel Gaza Saturdaythought",0,0,0,1,0,1,"Dont get too complacent caz it sey inna di Gaza one gone, another one VybzKartel Gaza Saturdaythought"
eng_ef909f95f2a1c78320270a75c5982898,You are an inspiration to those of us blue dots in red states. Kick ass. You always do.,0,0,0,0,0,0,You are an inspiration to those of us blue dots in red states. Kick ass. You MASKED_TOKEN do.
eng_db52d35bd2398fbeda7d9cfec4e54de4,We want Recount of pp7,0,0,0,0,0,0,We want Recount of pp7
eng_dfc12f015c0f8c51a93196fa60dfb793,Ill watch MSNBC if Elon buys it. Pretty much the only way. Lol.,0,0,0,0,0,0,Ill watch MSNBC if MASKED_TOKEN buys it. Pretty much the only way. Lol.
eng_60aba2c47bc9ef33cd1fb20a386efbdc,"Sounds like you have no idea what Zionism is, thats all.",0,0,0,0,1,1,"Sounds like you have no idea what Zionism is, thats all."
eng_951f17826ce52347c16d753f649b714e,Elon is an immigrant. Deport him! What are we waiting for? To live in an apartheid state. Fuck Elon!,0,1,0,1,0,1,MASKED_TOKEN MASKED_TOKEN immigrant. Deport him! What are we waiting for? To live in an MASKED_TOKEN. Fuck Elon!
eng_a426b81a123784056e1ad75107cfe29d,I rail against zionism quite a bit. I just want to say this again. Fuck antisemitism. ZionismJewish Happy hannakah yall,0,0,0,0,0,1,I rail against zionism quite a bit. I just want to say this again. Fuck MASKED_TOKEN. ZionismJewish Happy hannakah yall
eng_cdbcac241a148175488059f3b397a5d0,Wyoming to Red States. HOLD MY BEER!!!,0,0,0,0,0,0,Wyoming to Red States. HOLD MY BEER!!!
eng_cde34d12137c9825ef08ff44f0819347,why have I not heard or seen anyone talk about the Ben Gurion Canal Project in regards to the decimation Gaza? Is it a conspiracy theory or nah? thoughts?,1,1,1,0,1,0,why have I not heard or seen anyone talk about the Ben Gurion Canal Project in regards to the decimation Gaza? Is it a conspiracy theory or nah? thoughts?
eng_1fa75a8257b44cc58668cf6f8436cf3f,Stand with Ukraine against russian aggression,0,0,0,0,0,0,Stand with Ukraine against russian aggression
eng_eafb3cd03934546b84b89728828ee365,"IEBC LISTED 1,031,645 new voters in the second phase of the national voter registration exercise that ended on Feb 06.",0,0,0,0,0,0,"IEBC LISTED 1,031,645 new voters in the second phase of the national voter registration exercise that ended on Feb 06."
eng_0231d6218ae3592adaf2eeba137d0884,NYU Law Student Facing Backlash Over IsraelHamas War,0,0,0,0,0,0,NYU Law Student Facing Backlash Over IsraelHamas War
eng_cc23ee83967f1d6ac0e7b1e63b7f0fc6,YIAY2025 Donald Trump is unelected president,0,0,0,0,0,1,YIAY2025 Donald MASKED_TOKEN unelected president
eng_487b6d715ee412d674cdffc3abbedeb1,Distracted Joe Biden is not good,0,0,0,0,0,0,Distracted Joe Biden is not good
eng_819a7cd386950cb9b398095a725f3773,Israel slaughter in Palestine.. why ignore Gaza,0,0,0,0,0,0,Israel slaughter in Palestine.. why ignore Gaza
eng_820c5cdc36d5ff4876456814a3232d13,Student Alliance for Israel organizes vigil for IsraelisMassachusetts Daily Collegian,0,0,0,0,0,0,Student Alliance for Israel organizes vigil for IsraelisMassachusetts Daily Collegian
eng_425a391736b1822d167f1cbf0d195a6e,Donald Trump headlines South Dakota rally with Kristi NoemRapid City,0,0,0,0,0,0,Donald Trump headlines South Dakota rally with Kristi NoemRapid City
eng_4b89c4ae19888c17e254b717bf07bc4c,Zelensky Raises Prospect of European Peacekeepers in Ukraine @URL,0,0,0,0,0,0,Zelensky Raises Prospect of European Peacekeepers in Ukraine @URL
eng_956895798de489463e4d74eaf003cafc,Christian nationalism and white nationalism is ironically promulgated by the same demographicgroup.,1,1,0,0,0,0,MASKED_TOKEN and MASKED_TOKEN nationalism is ironically promulgated by the same demographicgroup.
eng_a818f1c63f5d957639ec1e93b2d6f490,Donald Trump says he would accept House speaker job,0,0,0,0,0,0,Donald Trump says he would accept House speaker job
eng_8fa4e82986bde4a9e8c0302b1d238d9a,These Kamala Harris compilations have been sending me,0,0,0,0,0,0,These Kamala Harris compilations have been sending me
eng_07fd2575d0c0414e726c0c9a413d2c39,Why Trump Nation voters ignored the lies of Fox NewsBergen Record,1,1,0,0,0,0,Why Trump Nation voters ignored the lies of Fox NewsBergen Record
eng_b522a1570c607da6256c3c2f2ec49e6d,Lefties failing to understand the difference between legal and illegal immigration yet again,1,0,1,0,0,1,Lefties failing to understand the difference between legal and illegal immigration yet again
eng_aaefdb02951e75cf5d81e3240a8a0f49,Biden admits that defund the police democrats are wrong,0,1,0,1,0,1,Biden admits that MASKED_TOKEN the police democrats are wrong
eng_eb52fbb125db51b0f04672a3a7a299ad,Agreed. I refuse to watch Jennings on CNN.,0,0,0,0,0,0,Agreed. I refuse to watch Jennings on CNN.
eng_e499097ed39eb0b3798718d075856f0a,"Cutting public spending to fund billionaires tax breaks Or is that too socialist for TDS? No, wait, its not a joke, of course!",0,1,0,1,0,1,"Cutting public spending to fund billionaires tax breaks Or is that too socialist for TDS? No, wait, its not a joke, of course!"
eng_636d1ef21bbb2e5e27d3feac9d9bcf57,Pontotoc Police Officer Zach Holloway Named 2023 Officer of the Year,0,0,0,0,0,0,Pontotoc Police Officer Zach Holloway Named 2023 Officer of the Year
eng_30bb246b4d3da4a244ba63631463a3ce,"But not for individual rights, which are now being erased by progressive policies. Heckuva job, progressives.",1,0,1,1,0,1,"But not for individual rights, which are now being erased by progressive policies. Heckuva job, progressives."
eng_4b0bed9164da07b0435e365a8203b794,Hi why did the house remove same day voter registration from the VOTES act? mapoli,0,0,0,0,0,0,Hi why did the house remove same day voter registration from the VOTES act? mapoli
eng_41c29b863e71d3923bbf938c5520cd63,"Okay. So Hamas fires on Israel while hiding behind human shields. Israel fires back, killing some of those human shields. Who is the murderer?",0,1,0,1,1,0,"Okay. So Hamas fires on Israel while hiding behind MASKED_TOKEN shields. Israel fires back, killing some of those MASKED_TOKEN MASKED_TOKEN. Who is the murderer?"
eng_4dd83f9fc4a42ce62f20ae985dd24797,"Fancy that. A hehim deciding that gender ideology takes priority over victims, womens rights and the law.",0,0,0,1,0,1,"Fancy that. A hehim deciding that gender ideology takes priority over victims, womens rights and the law."
eng_20bd91300ad250c0c5f5500379d6e9a1,Dean Plocher officially joins GOP primary for Missouri,0,0,0,0,0,0,Dean Plocher officially joins GOP primary for Missouri
eng_74d2f9509e29bfc3695a56f6cbf973bf,House Republicans demand answers on USBP El Centro,0,0,0,0,0,0,House Republicans demand answers on USBP El Centro
eng_b86aa341a7593c1e25259a3380d17951,I AM into Christianity and Socialism! Undecided on those other things.,0,0,0,0,0,0,I AM into Christianity and Socialism! Undecided on those other things.
eng_24c8161a78df8953258de06421186dea,One traitor helping another traitor. Were screwed,0,1,0,1,0,1,One MASKED_TOKEN helping another MASKED_TOKEN. Were screwed
eng_01ca330c0cdcdfb61d0591c376443d16,All because of Democrat open borders. FJB,1,0,1,0,0,0,All MASKED_TOKEN of Democrat open borders. FJB
eng_c170964aa28ee0583f9ee8568526eade,INTRODUCING VANESSA BLINGGGG AS GAZA SLIMMMM,0,0,0,0,0,0,INTRODUCING VANESSA BLINGGGG AS GAZA SLIMMMM
eng_d87da90f38a4f313daee4f9225fe1ec5,So.voter suppression and book banning isnormal?,0,0,0,0,0,0,So.voter suppression and book banning isnormal?
eng_deb641220b5eb037c1ad3b1bb59bf73c,"Nope, I heard we have open borders",0,0,0,0,0,0,"Nope, I heard we have open borders"
eng_29cd2eb18b00f799e51787de5d62cb2b,Imagine in terms of nationalism,0,0,0,0,0,0,Imagine in terms of nationalism
eng_3d283cf1be99f05543474135d2d01ffc,Financial reports show prominent Republicans backing,0,0,0,0,0,0,Financial reports show prominent Republicans backing
eng_fd437537cffd0ce8a4b58a75a477ddef,Just found out about German ethnic cleansing,0,0,0,0,0,0,Just found out about German MASKED_TOKEN cleansing
eng_b48d32dd24061710af1d76d14e05a2f9,Are red states stealing from California?,1,1,0,0,0,0,Are red states stealing from California?
eng_5dbd73b5ce48eee6066d771500efe897,"Craig Murray, Imperialism is Winning. Sadly many Scottish Nationalists are supporting this covert imperialism all over the world. Not opposing it is supporting it too.",1,1,0,1,0,0,"Craig Murray, Imperialism is Winning. Sadly many Scottish Nationalists are supporting this covert imperialism all over the world. Not opposing it is supporting it too."
eng_2fa6858e0eb008a4093891df11cfc946,Republicans get out and vote for the Republicans,0,0,0,0,0,0,Republicans get out and vote for the Republicans
eng_add12d6faf4b1f25618d1f5eebffa556,"You want progressive policies like those in Canada, then you need to vote Democrat.",0,0,0,0,0,0,"You want progressive policies like those in Canada, then you need to vote Democrat."
eng_dc5ce0099038c909befb5e397861c7a2,"Vivek Ramaswamy attacks U.S. aid to Ukraine, claiming it pushes Russia toward China, while ignoring the real threat of Russian aggression. He hides behind ""America First"" rhetoric to justify abandoning allies and appeasing dictators",0,1,1,0,0,1,"Vivek Ramaswamy attacks U.S. aid to Ukraine, claiming it pushes Russia toward China, while ignoring the real threat of Russian aggression. He hides behind ""America First"" rhetoric to justify abandoning allies and appeasing dictators"
eng_312041e208a9399c5de0ea147e97335e,"Maine shooting, IsraelHamas war, US airstrikesThe Grand Island Independent",0,0,0,0,0,0,"Maine shooting, IsraelHamas war, US airstrikesThe Grand Island Independent"
eng_be838926af70db3d718b9801e9cbb74e,"anyway, he just leaked it to Breitbart unless you think the FBI would choose Breitbart to leak to",0,0,0,0,0,0,"anyway, he just leaked it to Breitbart unless you think the FBI would choose Breitbart to leak to"
eng_24b5d547d860423ceafbb2d0a9cf5886,You should be in prison for election fraud,0,1,0,0,0,0,You should be in prison for election fraud
eng_cc8f85a4a9f6868bc28d3bb9d7e7d2c1,Pa. GOP emails shed new light,0,0,0,0,0,0,Pa. GOP emails shed new light
eng_b45b9097b73aa97277b760bf9b0129b1,Probably xenophobia was the bestsuited word.,0,0,0,0,0,0,Probably xenophobia was the bestsuited word.
eng_ac094bdfcf22ecf28819a868d0730e68,This is the kind of border security we need more of. canada,0,0,0,0,0,0,This is the kind of border security we need more of. canada
eng_ba831b92bfc19e7a3188f8edfd62457b,I disagree ion think its West Bank thing,0,0,0,0,0,0,I disagree ion think its West Bank thing
eng_d13e8992484fd762f94ff2fb3fd1a2dc,Whats happening in Israel? The deadly war with Hamas,0,0,0,0,0,0,Whats happening in Israel? The deadly war with Hamas
eng_a22b3799cc4092f7c725485f144dac01,Speedy recovery. The fight against Hamas and other left wing anti semitism is challenging.,0,0,0,0,0,0,Speedy recovery. The fight against Hamas and other left wing anti semitism is challenging.
eng_930174fa3e4d20ab7c68d8b8533a06e9,Israeli cybersecurity firm to open regional HQ in Tampa,0,0,0,0,0,0,Israeli cybersecurity firm to open regional HQ in Tampa
eng_2a2d1db66dfebb1cc68841bb955b0cf3,Where was Kamala Harris on January 6?,0,0,0,0,0,0,Where was Kamala Harris on January 6?
eng_7c2ac09d78f1b5ec72be8761d7e9a93a,Can you imagine the media frenzy if President Joe Biden had forgotten to swear someone in?,0,0,0,0,0,0,Can you imagine the media frenzy if President Joe Biden had forgotten to swear someone in?
eng_fc8df47144d83b75e7bf642317dd0659,"Please read the Save Act carefully. Ladies, pay attention. This bill will take your voting rights away. Our acts of respect and honor are being used against us now.",0,0,0,1,0,0,"Please read the Save Act carefully. Ladies, pay attention. This bill will take your voting rights away. Our acts of respect and honor are being used against us now."
eng_a3a0b82a1b032383d148423180d487b1,stress eating chip bcos might be deportation,0,0,0,0,0,0,stress eating chip bcos might be deportation
eng_c031dc820e95075fc339a554534cd815,"Renewed Gaza rockets, IDF strikes amid ongoing ceasefire",0,0,0,0,0,0,"Renewed Gaza rockets, IDF strikes amid ongoing ceasefire"
eng_bc8f3151a9883e8c5334be3848d8a18d,"""Socialism never took root in America because the poor see themselves not as an exploited proletariat but as temporarily embarrassed",1,0,0,1,0,0,"""Socialism never took root in America because the poor see themselves not as an exploited proletariat but as temporarily embarrassed"
eng_8d45eac33de8b2868c2e68430f794b26,"Ill take ""Russian propaganda"" over US propaganda any day.",1,1,0,0,0,0,"Ill take ""Russian propaganda"" over US propaganda any day."
eng_6fbee11ce399b6ce3a6f5820a07df04c,getting breakfast pho from a place playing clairo and mitski at 10am. multiculturalism is beautiful,0,0,0,0,0,0,getting breakfast pho from a place playing clairo and mitski at 10am. multiculturalism is beautiful
eng_d6b67ff7bddf3f0bd44e0e12364e77c6,"The woke mob wants to change the word ""penis"" to """,1,1,0,1,0,0,"MASKED_TOKEN mob wants to change the word ""penis"" to """
eng_4786a1f278da4a174f754f1c7802d153,"Who won the last elections in 2020, Adam? President Democrats House Democrats Senate Democrats",0,0,0,0,0,0,"Who won the last elections in 2020, Adam? President Democrats House Democrats Senate Democrats"
eng_ed5af226370e0597001ed34251e0ee3c,US immigration is gaming Google to create a mirage of mass deportations,0,0,1,1,1,1,US immigration is gaming Google to create a mirage of mass deportations
eng_6eea39bb9ca7e79f84ed8b398b12ce81,Iron Dome is made in Israel by Refael. A country the size of Ukraine would need several hundred systems which do not exist,0,0,0,0,0,0,Iron Dome is made in Israel by Refael. A country the size of Ukraine would need several hundred systems which do not exist
eng_bed09b856719e15ac267645ae5ad7f58,"A valid protest of a rigged election, that ended up having some sort of kerfuffle.",0,1,0,0,0,1,"A valid protest of a rigged election, that ended up having some sort of kerfuffle."
eng_a8da4c038e0001c8cdb8a6e46bffe591,BISF hosts panel on longstanding IsraeliPalestinian conflictThe Rice Thresher,0,0,0,0,0,0,BISF hosts panel on longstanding IsraeliPalestinian conflictThe Rice Thresher
eng_db3a2aec6b45cd1379ded805c16ee098,"Please inform the world voter suppression is real. Gerrymandering helped to swing the Electoral College, which should be abolished.",0,0,0,0,0,0,"Please inform the world voter suppression is real. Gerrymandering helped to swing the Electoral College, which MASKED_TOKEN abolished."
eng_1155c1adcf65944f80f5baa1ea4d3d10,Yes. A fascist to the core.,0,1,0,1,0,1,Yes. A MASKED_TOKEN to the core.
eng_0f6cb2a4d2c6bb589534bd47da065622,"Lets not forget that Jimmy Carter described Israel as an ""apartheid state"" in 2008.",0,0,0,0,0,0,"Lets not forget that Jimmy Carter described Israel as an ""MASKED_TOKEN state"" in 2008."
eng_0a2ec9ca379303c2495d9b6dff2042ad,These are people Im for immigration legal immigration,0,0,0,0,0,0,These are people Im for immigration legal immigration
eng_c025fb21d3a74b077d028044b07e8ff0,War Crimes are bad actually.,0,0,0,0,0,0,War Crimes are bad actually.
eng_b6ee5fc5e601b7cf90a6a7e78ff6aa7f,Novak appears to be getting the behind the scenes look at the filming of Border Security,0,0,0,0,0,0,Novak appears to be getting the behind the scenes look at the filming of Border Security
eng_54d8ee27d2e0369a3d750a074824e166,2 IOF soldiers were wounded after Palestinians threw an IED at their Jeep in the West Bank,0,0,0,0,0,0,2 IOF soldiers were wounded after Palestinians threw an IED at their Jeep in the West Bank
eng_927010e33891748214d4e0eff7d3baaa,"Jews promote faith and respect, zionism waves flags!",0,1,1,0,0,1,"Jews promote faith and respect, zionism waves flags!"
eng_ab5536555e36a96a067c240b4c0a77a0,BMS Student Recognized by Decatur Police Department,0,0,0,0,0,0,BMS Student Recognized by Decatur Police Department
eng_b57e51fe89bcceadc1612a818fcff3c9,OU community shares opinions on IsraelHamas war,0,0,0,0,0,0,OU community shares opinions on IsraelHamas war
eng_0ed57bf7d56281f574e179b2947f4127,theres no soul behind kamala harris eyes,0,1,0,1,0,0,theres no soul behind kamala harris eyes
eng_e295be73c5217b306e2b02591092071b,President Joe Biden has signed the social security fairness act.,0,0,0,0,0,0,President Joe Biden has signed the social security fairness act.
eng_834445df3ccd504cec48a8e3a60f03d5,"All of you supporting illegal immigration, , Youre stabbing Minorities in the back!",0,0,0,0,0,1,"All of you supporting illegal immigration, , Youre stabbing Minorities in the back!"
eng_7850b89439b79927e9cecacdbead37cc,"Was Trumps ethnic nationalism the key to his success? What does nationalism mean, and is it good for America and all Americans?",0,0,0,0,0,0,"Was Trumps MASKED_TOKEN nationalism the key to his success? What does nationalism mean, and is it good for America and all Americans?"
eng_a68715d4018c6674fabd77ffe4f0db6c,Fuck Kamala Harris that black rat,1,1,1,1,1,0,MASKED_TOKEN Kamala Harris that black rat
eng_f64ff3158587dde94c369767eac28dec,GOP ousts Democrat Czarnezki from Wisconsin Elections,0,0,0,0,0,0,GOP ousts Democrat Czarnezki from Wisconsin Elections
eng_d40c1edf998b5adf8a9732fde4a4b720,"Exactly, but still bombing gaza, west bank and Lebanon. ""Cease fire"" my arse!",0,0,0,0,0,0,"Exactly, but still bombing gaza, west bank and Lebanon. ""Cease fire"" my arse!"
eng_f8b7f89641e6fcc85c67897c86367279,Market protection and job creation. Its socialism v.s. socialism again.,0,0,0,0,0,0,Market protection and job creation. Its socialism v.s. socialism again.
eng_eca364225788ca8a05b041569bd5adda,Real democracy doesnt have an electoral college.,0,0,0,0,0,0,Real democracy doesnt have an electoral college.
eng_14b59d04b46ba7e866ae7409a7ec3c27,Only fascist countries silence their people.,0,0,0,1,0,0,Only MASKED_TOKEN countries silence their people.
eng_f5b0e8618ad3790a84c38c4230695b60,The danger at tapping into populism is all that frustration and rage you stoke will inevitably turn on you once they realize you used them.,0,0,0,0,0,0,The danger at tapping into populism is all that frustration and rage you stoke will inevitably turn on you once they realize you used them.
eng_111fe1d5d1f46e14928d1ffc5faf8220,"Donald Trump to skip next GOP debate, will meet with auto",0,0,0,0,0,0,"Donald Trump to skip next GOP debate, will meet with auto"
eng_a0e9e7c9a0a18872b545a1de3520d16a,Canada should step up sanctions on Russia. StandWithUkraine,0,0,0,0,0,0,Canada should step up sanctions on Russia. StandWithUkraine
eng_aceb20502268744f383bfbf29e9d4b8b,I think they will be swept out of office. They are allowing a whole series of things which were politically costly in the past. Im skeptical politics has changed enough or that voter fraudsuppression can overcome the backlash that is coming.,0,0,0,0,0,0,I think they will be swept out of office. MASKED_TOKEN allowing a whole series of things which were politically costly in the past. Im skeptical politics has changed enough or that voter fraudsuppression can overcome the backlash that is coming.
eng_32c2a1607cdee3df20e2431c19798422,"More of this, please. And no more throwing trans kids, migrants, and asylum seekers under the bus.",1,0,0,0,1,1,"More of this, please. And no more throwing trans kids, migrants, and asylum seekers under the bus."
eng_d4124047bc9ce8bdc18da949ebf2af77,Donald Trump. What a nob.,0,1,0,1,1,0,Donald Trump. What a nob.
eng_596d12bd0bf60e77a3989aeb7157ab0f,Donald Trump testifies in New York fraud trial,0,0,0,0,0,0,Donald Trump testifies in New York fraud trial
eng_dee3bcf18e47cbeaf6a485c315ffd2cd,Donald Trump holds commanding lead 5 months,0,0,0,0,0,0,Donald Trump holds commanding lead 5 months
