id,text,stereotype,vilification,dehumanization,extreme_language,lack_of_empathy,invalidation,text_masked
eng_d16135b6e6530d38e6aaef4822538969,"Theyll stew themselves in multiculturalism when its safe and easy but the minute, the second, the nanosecond it becomes hard, theyll burn it all down, sweep up the ashes and repackage it to you as white simple heros journey bullshit.",1,1,0,0,0,0,"Theyll stew themselves in multiculturalism when its safe and easy but the minute, the second, the nanosecond it becomes hard, theyll burn it all down, sweep up the ashes and repackage it to you as white simple heros journey bullshit."
eng_ba0ecac0255321c9b893e7ef9db756ed,Journalist killed in West Bank during Palestinian Authority raid sayidina.comjournalistk... journalist killed WestBank Bank Palestinian,0,0,0,0,0,0,Journalist killed in West Bank during Palestinian Authority raid sayidina.comjournalistk... journalist killed WestBank Bank Palestinian
eng_9c6100350fdbbe08bf90f75b4d4db042,Republicans in Congress are Spineless!!,1,0,0,1,0,1,Republicans in Congress are Spineless!!
eng_f6a600f45530d3e84317598caa1df7e4,Benson Says Clerks Statewide Are Ready for Early Voting,0,0,0,0,0,0,Benson Says Clerks Statewide Are Ready for Early Voting
eng_060b919e8a2fb8aa53a972ad322998d3,Ya well Lindsey said Trumps insurrection was too much too then stuck his head right back up Trumps fat orange ass.,1,1,0,1,1,0,Ya well Lindsey said Trumps insurrection was too much too then stuck his head right back up Trumps fat orange ass.
eng_c1dbc59827a932a6b9e9cfb3c81a3f62,"Israel settlement plans ""In a year we will live in Gaza"" THE SPIEGEL research the Israeli army is systematically destroying cities and expelling the population in northern Gaza. It is preparing the ground for a military occupation and for the possible construction of new Jewish settlements.",0,0,0,0,0,0,"Israel settlement plans ""In a year we will live in Gaza"" THE SPIEGEL research the Israeli army is systematically destroying cities and expelling the population in northern Gaza. It is preparing the ground for a military occupation and for the possible construction of new Jewish settlements."
eng_3b4b0fcaa9ed1f3e5eecf220c4db87f7,Drop down voting patterns in swing states are suspicious smartelections.substack.compsoclean?r...,0,0,0,0,0,0,Drop down voting patterns in swing states are suspicious smartelections.substack.compsoclean?r...
eng_cb40a6b0fab5d62598272ec5d205add1,"Drop the ""Jewish state"" shit it only allows antisemitism to propagate by attaching Israels crimes to Jewish people as a whole.",1,1,1,0,0,1,"Drop the ""Jewish state"" MASKED_TOKEN it only allows MASKED_TOKEN to propagate by attaching Israels crimes to Jewish people as a whole."
eng_03b57e2718c0b4c4a3c68737235d2dd3,Fontana student urges ceasefire in war between Israel and,0,0,0,0,0,0,Fontana student urges ceasefire in war between Israel and
eng_f5411bbd96a776cbbe1d980ba3d4216f,"It is not that Mike Pence lovingly eats his dogs hair, its that Mike Pence stupidly invades fruitflies during choir.",1,1,0,1,0,1,"It is not that Mike Pence lovingly eats his dogs hair, its that Mike Pence stupidly invades fruitflies during choir."
eng_8e48106a4530bc97c60d1726ec865d49,There are anti Zionism Jews. What of them?,0,0,0,0,0,0,There are anti Zionism Jews. What of MASKED_TOKEN?
eng_e874cf6fbf68690f54addbccab229578,Republicans 2016 No one is above the law Republicans 2022 Only Republicans are above the law,1,1,0,1,0,1,Republicans 2016 No one is above the law Republicans 2022 Only Republicans are above the law
eng_e56ba3329a796030952e357027a8a15e,Even election fraud couldnt stop her.,0,1,0,1,0,0,Even election fraud couldnt stop her.
eng_5c5323933b657b15603e55f8ed537469,Lots of blue dots in red states that dont deserve to die,0,0,0,0,0,0,Lots of blue dots in red states that dont deserve to die
eng_e0159642973142eb761311f3c3e19644,"Ken Paxton, lawyers test limits of impeachment trial gag",0,0,0,0,0,0,"Ken Paxton, lawyers test limits of impeachment trial gag"
eng_4274cde1af892c8cbc26c27042d7657a,Studies Address Americans Views of Israeli GovtAtlanta Jewish,0,0,0,0,0,0,Studies Address Americans Views of Israeli GovtAtlanta Jewish
eng_ad62e071de40b37c3e44fd349722b7b5,Tell us about the election fraud scandal.,1,1,0,0,0,1,Tell us about MASKED_TOKEN fraud scandal.
eng_53d6dbefe9a281850852a5d8dba1704e,"So, your pronouns are HeHimHis. In fact, theyre capitalized. Please remind the antiwoke mob.",1,1,1,0,1,1,"So, your pronouns are HeHimHis. In fact, theyre capitalized. Please remind the antiwoke mob."
eng_fa5b40d6212a22412ea6d12dfbd58da7,"Great. We now have the mullet presidency. Xenophobia in the front, oligarchy in the back.",0,1,0,0,0,0,"Great. We now have the mullet presidency. Xenophobia in the front, oligarchy in the back."
eng_8b3987c4805e6ad7a57ea86c39f5b698,Teaching African refugees to program Javascript,0,0,0,0,0,0,Teaching African refugees to program Javascript
eng_c2be52de644bc11c032dc925efbaf508,With one thing I would disagree corruption and allowing friends of the king to break the laws are part of the real conservative values.,1,1,0,1,0,0,With one thing I would disagree corruption and allowing friends of the king to break the laws are part of the real conservative values.
eng_9ec9fee9140082040dfeb933cbc76b56,"Russia is fascist. Ukraine is fascist. NATO is fascist. No matter who wins, everyone loses.",1,0,0,1,0,0,"Russia is MASKED_TOKEN. Ukraine is fascist. NATO is fascist. No matter who wins, everyone loses."
eng_76414fdc12383532a338ed0014d1d338,Trudeau should take the opportunity to reduce Russian aggression in the arctic,0,0,0,0,0,0,Trudeau should take the opportunity to reduce Russian aggression in the arctic
eng_1d17557f435e55fe5fdc930202e52f0c,Were still arguing over voter fraud existing,0,0,0,0,0,0,Were still arguing over voter fraud existing
eng_8cddc077c20b0aef53034203d8554181,Because he hasnt been charge with insurrection DUH,0,0,0,0,0,0,Because he hasnt been charge with insurrection DUH
eng_0bedbe567f5e7d6d179b4451391b2e82,"There has to be a hand, paper recount of ballots for a precinct, and that total compared to the totals for that tabulator. Thats the only way to PROVE that the votes were stolen. Harris didnt ask for this before election certification..",0,0,0,0,0,0,"There has to be a hand, paper recount of ballots for a precinct, and that total compared to the totals for that tabulator. Thats the only way to PROVE that the votes were MASKED_TOKEN. Harris didnt ask for this before election certification.."
eng_156d49d87537a8368fbe76f8571e33d0,Halt NATO expansion Force a NATO reduction,0,0,0,0,0,0,Halt NATO expansion Force a NATO reduction
eng_28ccc039c3a42824171939e67c5c5e7c,Take Jim Acosta to MSNBC,0,0,0,0,0,0,Take Jim Acosta to MSNBC
eng_04e3015ce239896030ea8934a2b77ffd,"Wait, wasnt he supposed to be running the new Iron Dome?",0,0,0,0,0,0,"Wait, wasnt he supposed to be running the new Iron Dome?"
eng_d0ee97b42590bcd5d5ee6f04373fc320,Are you telling me that MAGA folks dont have deep nuance to their xenophobia?,1,1,0,1,0,1,Are you telling me that MAGA folks dont have deep nuance to their MASKED_TOKEN?
eng_e727d1c9e5953cda7210494a9c1825cb,Mike Pence is the swamp,0,0,0,0,0,0,Mike Pence is the swamp
eng_35e5c39633bf57e8176db82b42f9f280,Ok snowflake dont cry about it,1,1,0,0,1,0,Ok snowflake dont cry about it
eng_316c175b6d1032182aefa36cc47d7018,Not only propaganda apparatus. Intelligence apparatus too,0,0,0,0,0,0,Not only propaganda apparatus. Intelligence apparatus too
eng_3c396e25f2db6a72a21be15cc6e3c190,Border security was never the issue. The goal is to drum up populist support by attacking Canada.,0,0,1,0,1,1,Border security was never the issue. The goal is to drum up populist support by attacking Canada.
eng_7b6b78f655b88bdedd97b589d51cc8e8,The US Senate voted for NATO expansion.,0,0,0,0,0,0,The US Senate MASKED_TOKEN NATO expansion.
eng_7aed13a7697be5ab0a0e70f5768faf1e,Its because early voting was before the debate.,0,0,0,0,0,0,Its MASKED_TOKEN early voting was before the debate.
eng_de94166a8e049760d47f8d19e6212fc1,Kamala Harris or trump win no one else,0,0,0,0,0,0,Kamala Harris or trump win no one else
eng_d55ad466254d515d661cdb535462ba8b,Early voting lasts Oct. 17 to Nov. 4.,0,0,0,0,0,0,Early voting lasts Oct. 17 to Nov. 4.
eng_eec1d2b096a2980efe601b6d21c4b9c1,"continued military aid to Ukraine, and controversial climate initiatives."" ""As Congress spends to reward its favored pet projects, the American taxpayers are forced to pay through high prices and crippling interest rates,"" Paul said.",0,0,0,0,0,0,"continued military aid to Ukraine, and controversial climate initiatives."" ""As Congress spends to reward its favored pet projects, the American taxpayers are forced to pay through high prices and crippling interest rates,"" Paul said."
eng_d75b42bec968a022c05e94b767aa94fd,What actually happened to Kamala Harris?,0,0,0,0,0,0,What actually happened to Kamala Harris?
eng_95fea85652c0b62f6971f3db3ed6a58b,"AFP Ukraine demands immediate ceasefire, Russian troop withdrawal.",0,0,0,0,0,0,"AFP Ukraine demands immediate ceasefire, Russian troop withdrawal."
eng_093c34c6e4cbbc904bae7f9e030b7a6d,Asylum seekers prevented from working sometimes have to resort to shoplifting. wato,0,0,0,0,0,0,Asylum seekers prevented from working sometimes have to resort to shoplifting. wato
eng_154e8f522918708a2c86c85969578ef9,Putin says Zelensky is a Nazi Orban says Zelensky is the International Jew. Messaging mixup,1,1,1,1,0,0,Putin says Zelensky is a Nazi Orban says Zelensky is the International Jew. Messaging mixup
eng_a24f3cb3de27296dbe7bee4d38955a57,The twelve disciples were the OG woke mob,0,0,0,0,0,0,The twelve disciples were the OG MASKED_TOKEN
eng_cf82a967319e72b5f5a39256781a4e63,Gut Feeling the DS is already in the Electoral College.,1,0,1,1,0,0,Gut Feeling the DS is already in the Electoral College.
eng_e2b4eab020a4198612aac8f7701753d9,Those of us stuck in red states would appreciate a few tunnels at the borders.,0,0,0,0,0,0,Those of us stuck in red states would appreciate a few tunnels at the borders.
eng_6065e995c12bb619881660d5d92e62f1,TRAITOR... TRAITOR...TRAITOR... YOU ARE A WASTE OF OXYGEN,0,1,1,1,0,0,TRAITOR... MASKED_TOKEN...TRAITOR... YOU ARE A WASTE OF OXYGEN
eng_ee1bf46b358c061704fe0c1b2f747448,Lol. You had illegal voting procedures in all the swing states and you didnt say a word. Sit down and shut up,0,1,0,1,0,1,Lol. You had illegal voting procedures in all the swing states and you didnt say a word. Sit down and shut up
eng_2f94ca07458d2cdea19ed9c3a93026e0,Biden administration prepares bln military aid package for Ukraine Reuters,0,0,0,0,0,0,Biden administration prepares bln military aid package for Ukraine Reuters
eng_0561dfcfefdbce35b107faaeb66be8bf,"Never thought I would say God bless Mike Pence, but I am today.",0,0,0,0,0,0,"Never thought I would say God bless Mike Pence, but I am today."
eng_ffcf403d4c5a84fb1e485c020db1662f,Thats what early voting is for.,0,0,0,0,0,0,Thats what early voting is for.
eng_aa3d90eb9cb6bd84a23509f2a1f55570,"They also saved Ukrainian Nazis to use in order to Nazify Ukraine in ""project Aerodynamic""",1,1,1,1,0,0,"They also saved MASKED_TOKEN MASKED_TOKEN to MASKED_TOKEN in order to Nazify Ukraine in ""project Aerodynamic"""
eng_ac88ae5e0aaf29dc7de76d69b487a910,does sjw stand for social justiceshipping warrior,0,0,0,0,0,0,does sjw stand for social justiceshipping warrior
eng_8b3e940af11e883d445e4ba3b7b3a900,Every accusation is a confession. Hes admitting to his recent election fraud right there.,0,1,0,1,0,0,Every accusation is a confession. MASKED_TOKEN admitting to his recent election fraud right there.
eng_708550293a4a9529e5823f063b6bf2c2,"PA voting rights ruling, study latest on undated mail ballots",0,0,0,0,0,0,"PA voting rights ruling, study latest on undated mail ballots"
eng_19a77f56099d47b2117ba9e2fdbbe575,AOC slams GOP for criticizing Bowman over fire alarm,0,0,0,0,0,0,AOC slams GOP for criticizing Bowman over fire alarm
eng_f6de639c2b0e1509845569375f0fa182,"NRA, you had one job! One!!",0,0,0,0,0,0,"NRA, you had one job! One!!"
eng_d01f573e84138987baaefd97302b8123,woke birthright citizenship toke birthright imperialism,0,0,0,1,0,0,woke birthright citizenship toke birthright imperialism
eng_f099668b73a95192a26b4a6cb0eec128,"Britain announced a new package of military aid to Ukraine worth 286 million, Reuters. Thank you, Britain",0,0,0,0,0,0,"Britain announced a new package of military aid to Ukraine worth 286 million, Reuters. Thank you, Britain"
eng_130af2a4289c06845e7e748072b7b4d0,Arizonans in Israel bear witness to Israelis scariest time,0,0,0,0,0,0,Arizonans in Israel bear witness to Israelis scariest time
eng_b6bef13028ed746e6ed75f9fab1d3c06,What was a child doing hanging out with Islamic Jihad members? Smells like human shields.,1,1,1,0,0,0,What was a child doing hanging out with Islamic Jihad members? Smells like MASKED_TOKEN.
eng_f4e4f704a3a7d7ffbaad3c18a372c4db,"Prior to the Operation, the IDF evacuated some 350 patients to mitigate the risk of civilian casualties during the operation.",0,0,0,0,0,0,"Prior to the Operation, the IDF evacuated some 350 patients to mitigate the risk of civilian casualties during the operation."
eng_86cc5e09dbc328535a2f92ecfeba3ab8,Time for a lasting ceasefire. And arrest Netanyahu,1,0,0,0,0,0,Time for a lasting ceasefire. And arrest Netanyahu
eng_f913ff09a56e65a57ab0c3833f04d5ef,"feel like yacines complex is a uniquely bizarre combination of reaction to canadian multiculturalism and selfloathing, compounded by being an outsider¬≤",1,1,1,0,0,0,"MASKED_TOKEN like yacines complex is a uniquely bizarre combination of reaction to canadian multiculturalism and selfloathing, compounded by being an outsider¬≤"
eng_f8b0715d110e89100065ba4551cc6ff2,But what good did impeachment do the last two times?! It didnt prevent him from continuing his criminal agenda!,1,1,0,1,1,0,But what good did impeachment do the last two times?! It didnt prevent him from continuing his criminal agenda!
eng_1914cdc0eb03db4b115bc521e699c641,The map in your kids classroom is wrong. Nablus is NOT part of Israel. The people of Nablus are not Israeli citizens. They are living under a belligerent military occupation which has to end as soon as possible.,0,1,0,1,0,1,The map in your MASKED_TOKEN classroom is wrong. Nablus is NOT part of Israel. The people of Nablus are not Israeli citizens. They are living under a belligerent military occupation which has to end as soon as possible.
eng_540b6bca7b27467b180fab8291f62d9b,"A victory for voting rights in Wisconsin! Yesterday, the Wisconsin Supreme Court decided to preserve the ability of cities to designate inperson absentee voting sites and to use a mobile voting van. StateCourtsMatter @URL",0,0,0,0,0,0,"A victory for voting rights in Wisconsin! Yesterday, the Wisconsin Supreme Court decided to preserve the ability of cities to designate inperson absentee voting sites and to use a mobile voting van. StateCourtsMatter @URL"
eng_02d29e28e6f6c08f6fb0fad14f9dc70f,Really useful app regardless of your immigration status. Please share.,0,0,0,0,0,0,Really useful app regardless of your immigration status. Please share.
eng_90a1806672f7d1a0251547e250470373,The only thing we get from them is oil and election interference. They have the GDP of Iowa. No loss to us. Buh bye.,0,1,0,1,0,1,The only thing we get from them is oil and election interference. They have the GDP of Iowa. No loss to us. Buh bye.
eng_9e91109f66bc20e08c9d6ab221695c71,"Fox news is outdoing itself in vacuous, less that intelligent bull.",0,1,0,1,0,0,"Fox news is outdoing itself in vacuous, less that intelligent bull."
eng_d99b1bb349484940f893a0e0204c68c3,Nationalism has ruined this ummah,0,1,0,1,0,1,Nationalism has ruined this ummah
eng_e723c9ef8c21c83c1d5851a4586f78d9,the woke mob is making me publicly acknowledge the sovereign rights of Israel,1,0,0,0,0,0,the MASKED_TOKEN is making me publicly acknowledge the sovereign rights MASKED_TOKEN
eng_5961ad8dd4d7bf4231784dafca1882c4,"Stupids order to block all grants and loans unless Agencies had been directed to answer a series of yes or no questions on each federal program by Feb. 7. The questions included ""does this program promote gender ideology?"" and ""does this program promote or support in any way abortion?"" Holy shit",0,0,0,0,0,0,"Stupids order to block all grants and loans unless Agencies had been directed to answer a series of yes or no questions on each federal program by Feb. 7. The questions included ""does this program promote gender ideology?"" and ""does this program promote or support in any way abortion?"" Holy shit"
eng_6bfed0d5c779d6e5918495c77699acef,Donald Trump Mugshot Never heard that at Wharton,0,0,0,0,0,0,Donald Trump Mugshot Never heard that at Wharton
eng_3940809582d9e75230b7493940e46f6b,Kensington evangelical challenging Fischbach for GOP nodAlexandria Echo Press,0,0,0,0,0,0,Kensington evangelical challenging Fischbach for GOP nodAlexandria Echo Press
eng_946226acf0537676a616b18c8a785641,America First Republicans appear in court as infighting,0,0,0,0,0,0,America First Republicans appear in court as infighting
eng_b40747d2b3892be31ca22c74055b5d9d,Professor John Mearsheimer NATO Expansion Provoked Russia,0,0,0,0,0,0,Professor John Mearsheimer NATO Expansion Provoked Russia
eng_7f6c91aaa49a62539d6cf4c372f58974,Zionism creates antisemitism. Zionists create antisemites.,1,1,0,1,0,0,Zionism creates antisemitism. Zionists create antisemites.
eng_d8d7d0662139da9e2395bd1402a21920,Donate to friends of the IDF!,0,0,0,0,0,0,Donate to friends of the IDF!
eng_ee76c7b2ed92d086bec17ca8adcad37d,capitalism aims to turn us into npcs,0,0,0,0,0,0,capitalism aims to turn us into npcs
eng_63d6e4716f0aa7148608671857d4c72a,He has Russia and Ukraine discussing a ceasefire already.,0,0,0,0,0,0,He has Russia and Ukraine discussing a ceasefire already.
eng_a6fce8f7ed571eaf695777bd44e433fb,DANG RIGHT!!! Far right! Extreme right! Dick TATOR RIGHT!,0,1,0,1,0,0,DANG RIGHT!!! Far right! Extreme right! Dick TATOR RIGHT!
eng_a028f4e1599c5770eca11d34458974fb,Really working to make sure people understand that cities are under military occupation,0,0,0,0,0,0,Really working to make sure people understand that cities are under military occupation
eng_cd861c186ef04613fe17f7df16229c7d,"Does ""presence"" and ""took control of"" sound better than ""military occupation""? Yes, clearly it does",0,0,0,0,0,0,"Does ""presence"" and ""took control of"" sound better than ""military occupation""? Yes, clearly it does"
eng_3fad6ff3bc1e061cc1f79c1898e6dd32,I am boycotting MSNBC until they stop talking about swelling between the anus and genitals.,0,0,0,1,1,0,I am boycotting MSNBC until they stop MASKED_TOKEN about swelling between the anus and genitals.
eng_c96725defbc139fb326274e5ad528cda,Once while i encourage ppl in swing states to vote blue.,0,0,0,0,0,0,Once while i encourage ppl in swing states to vote blue.
eng_380ad4dc96e93fff5b003f1d552d697f,Kamala Harris should to get a BBL,0,0,0,0,0,0,Kamala Harris should to get a BBL
eng_75da437b634b3884aeb0f4d8fcd3797b,Can impeachment start this soon? He needs to be removed from office.,0,1,0,0,0,0,Can impeachment start this soon? He needs to be removed from office.
eng_f7f1cc2032a9826dae8aeb50415992d5,MSNBC should drop Morning Joe for Morning Jim.,0,0,0,0,0,0,MSNBC should drop Morning Joe for Morning Jim.
eng_b828bba08a3beefae594e4af33713c95,UK announces 283 million military aid package for Ukraine kyivindependent.comukannounces...,0,0,0,0,0,0,UK announces 283 million military aid package for Ukraine kyivindependent.comukannounces...
eng_491c166fc77d39d35f00d66542c80858,Yesterday Mike Pence loves poo,0,1,0,0,0,0,Yesterday Mike Pence loves poo
eng_56f895245783c7705d4a2e1dcbdb0517,Sit down. We dont need your trumpism negativity.,0,1,1,0,0,1,Sit down. We dont need your trumpism negativity.
eng_ca9e8ed0375acbc122255b1b449584f7,Zelensky doesnt run America. Remember,0,0,0,0,0,0,Zelensky doesnt run America. Remember
eng_5f0b532e1a614c2296f0508adcaf41a6,Voter Registration I.D. must be shown. This is a must!,0,1,0,1,0,1,Voter Registration I.D. must be shown. This is a must!
eng_d4f3772cb4aa35801a72010e472f906a,Why didnt anyone protect joe biden from all this embarrassment? They should have done something sooner,0,1,0,1,1,1,Why didnt anyone protect joe biden from all this embarrassment? They should have done something sooner
eng_4589d8be87d2ad051fddb35a8f8ae79e,"How surprising. Our govt is still ""friends"" of this genocidal, apartheid state.",1,1,1,1,1,0,"How surprising. Our govt is still ""friends"" of this MASKED_TOKEN, MASKED_TOKEN."
eng_dc56c4da4ad2431b824b418013b8b46e,Former VP Mike Pence ends campaign for White House,0,0,0,0,0,0,Former VP Mike Pence ends campaign for White House
eng_ce6d72d1f37e31b0e8f5db921a64ab64,Maybe Blue States shouldnt give taxes to the federal government and see how well that plays out!,0,0,0,0,0,0,Maybe Blue States shouldnt give taxes to the federal government and see how well that plays out!
eng_dd5b2242889ab10ccaf98492d9d197f0,The media is the enemy of the people!,0,1,0,1,0,0,The media is the MASKED_TOKEN MASKED_TOKEN!
eng_ab9fe351dd1de2ce4f443c44dd6b8967,And the west yawns wtf bunch of pussies in the west cant keep us safe from Russian aggression,1,1,0,1,1,1,And the west yawns wtf bunch of pussies in the west cant MASKED_TOKEN us safe from Russian aggression
eng_1661056bc00057507ba5e8f7b7505037,"This will be a MASSIVE mistake when the DOJ is used as cudgel for Trumps retribution campaign. Warnock, Ossoff, Baldwin, Slotkin all represent swing states and have held on to their moral compass why not Fetterman?",1,0,0,0,0,1,"This will be a MASSIVE mistake when the DOJ is used as cudgel for Trumps retribution campaign. Warnock, Ossoff, Baldwin, Slotkin all represent swing states and have held on to their moral compass why not Fetterman?"
eng_eb97a4d088c782f0bc5346c75684bad1,Any anti second amendment Ukrainians out there?,0,0,0,0,0,0,Any anti second amendment Ukrainians out there?
eng_235b4d90ff2ab8580235d651ab96eb4c,"1945 The Allied Control Council, the military occupation governing body of Germany, formally takes power.",0,0,0,0,0,0,"1945 The Allied Control Council, the military occupation governing body of Germany, formally takes power."
eng_52730af7eba1efe9ee6008fe75578911,nationalism in india today yay,0,0,0,0,0,0,nationalism in india today yay
eng_9096f003456bae6709012e005853a18c,London stands together in the deportation of one Sadio Mane,0,0,0,0,0,0,London stands together in the deportation of one Sadio Mane
eng_3990177f082c4f1ac995731f46f0ab6d,NATO has taken over coordination of Western military aid to Ukraine from the U.S. as planned in a move widely seen as aiming to safeguard the support mechanism against NATO sceptic U.S. Presidentelect Donald Trump. @URL,0,0,0,0,0,0,NATO has taken over coordination of Western military aid to Ukraine from the U.S. as planned in a move widely seen as aiming to safeguard the support mechanism against NATO sceptic U.S. Presidentelect Donald Trump. @URL
eng_7696a660184b8bcd59ae5a9464df722c,Socialist at a push .. but Communist? Thankfully theyve found common ground on Palestine and made the correct decision here.,0,0,0,0,0,0,Socialist at a push .. but Communist? Thankfully theyve found common ground on Palestine and made the correct decision here.
eng_82ad7151fea659919942a0fc51a15054,That would ruin the barely hidden xenophobia.,0,1,0,1,0,1,That would ruin the barely hidden MASKED_TOKEN.
eng_14f63e5e74bf3548c41770e31202bd0a,"And still countless victims of the apartheid state, with the idf murdering children and adults every minute passing. freepalestine freeluigi",0,0,0,0,0,1,"And still countless victims of the MASKED_TOKEN, with the idf murdering children and adults every minute passing. freepalestine freeluigi"
eng_c431b9c36a43a27403a7cbe5a66c705f,Round 2 of voter registration is going on ensure that youre part WeNdioMdosi,0,0,0,0,0,0,Round 2 of voter registration is going on ensure that youre part WeNdioMdosi
eng_51f7551e381ebec339045cb04dacc255,"But, but, theyre conscientious objectors to ethnic cleansing genocide.",0,0,0,0,0,0,"But, but, theyre conscientious objectors to MASKED_TOKEN genocide."
eng_17370143fba9f2d11fa6da95fdb3ccc4,When do we call tyranny and implement the Second Amendment the right is always yelling about?,0,0,1,1,0,0,When do we call tyranny and implement the Second Amendment the right is always yelling about?
eng_2207bbf75809d4ecb98f5ea56a5738fc,"Remember folks We follow MAGA Leninism, not TrumpismLeninism TAILISM",0,0,0,0,0,0,"Remember folks We follow MAGA Leninism, not TrumpismLeninism TAILISM"
eng_f52ed2865d5c798fa29c6843185df3d9,Biden says no ceasefire in IsraelHamas war until hostages,0,0,0,0,0,0,Biden says no ceasefire in IsraelHamas war until hostages
eng_2ca265e5fb6608d566317413ebc3358e,47th District Republicans kicked out of Kent Cornucopia,0,0,0,0,0,0,47th District Republicans kicked out of Kent Cornucopia
eng_7bb23502dcfd13796d65712c224d9171,"Those who call themselves ""common Japanese people"" reveal they are in fact extreme right cults.",1,0,1,1,0,1,"Those who call themselves ""common Japanese people"" reveal they are in fact extreme right cults."
eng_015229c8af30bf04d508b4b1cbe7465b,Thats Red States for you blame others,1,0,1,0,0,0,Thats Red States for you blame others
eng_a47e5c342e1d2fef4779eec842a66134,You guys have got to fix that Electoral College,0,0,0,0,0,0,You guys have got to fix that Electoral College
eng_066cab40fd11110ea5fcc67d3495b798,"Just follow our neighbour, Singapore. This is basic thing in border security and enforcement.",0,0,0,0,0,0,"Just follow our neighbour, Singapore. This is basic thing in border security and enforcement."
eng_ab7400bdc3a74f14e11f3f3fa4bcb9a8,New Hampshire has a chance to reject TrumpismValley,0,0,0,0,0,0,New Hampshire has a chance to reject TrumpismValley
