id,text,stereotype,vilification,dehumanization,extreme_language,lack_of_empathy,invalidation,text_masked
eng_19c406cbd375e4b90ebc1b7b928d5a17,What a bunch of bullshit and propaganda.,0,0,0,0,0,0,What a bunch of bullshit and propaganda.
eng_505d9a827620bb3d4e186479996d80b1,"After recount, writein Liam Watson wins Blacksburg Town",0,0,0,0,0,0,"After recount, writein Liam Watson wins Blacksburg Town"
eng_b5177f6d0d645143e0e4089d54b33efb,Once a traitor always a traitor,0,0,0,0,0,0,Once MASKED_TOKEN MASKED_TOKEN a traitor
eng_e3ed6224dd9c70d7dfae61c91fd15c14,Remove MTG and you have the democrats.,0,0,0,1,0,1,Remove MTG and you have the democrats.
eng_010225ddefff41f00845872f80b1b97d,my ethnic cleansing is very socialist why do you ask,1,1,1,1,1,1,my MASKED_TOKEN is very socialist why do you ask
eng_c0aa9ad5607c13ae9e983487a566c5f3,Whats your plan for the open borders Bobby???,0,0,0,0,0,0,Whats your plan for the open borders Bobby???
eng_ef1472c70d04335840714c0bb933da1a,"CSG holds meeting, students speak on IsraelHamas warThe Michigan",0,0,0,0,0,0,"CSG holds meeting, students speak on IsraelHamas warThe Michigan"
eng_66dbd3404f5a1abe15b56712b0faefe0,"They include a sextrafficker as attorneysgeneral, a drunkenrapist as secretaryofdefense, a Putinlackey to head nationalintelligence, a demented goon to direct the FBI, and to headup Health and Human Services, a fruitloop who never met a conspiracy theory he didnt like.",1,1,1,1,0,0,"They include a sextrafficker as attorneysgeneral, a drunkenrapist as secretaryofdefense, a Putinlackey to head nationalintelligence, a demented goon to direct the FBI, and to headup Health and Human Services, a fruitloop who never met a conspiracy theory he didnt like."
eng_e5a37b8beb78a393ee5506eaf8b817c2,"Finally, a Corporation willing to fight back against the antiwoke mob. @URL",0,0,0,0,0,0,"Finally, a Corporation willing to fight back against the antiwoke MASKED_TOKEN. @URL"
eng_ea4883f3af80342fbac096ae921d51fe,"fck giving socialism farm aid to farmers they voted against government help they voted for trump and republicans, let them pull themselves up by their bootstraps",1,1,0,1,1,0,"fck giving socialism farm aid to farmers they voted against government help they voted for trump and republicans, let them pull themselves up by their bootstraps"
eng_7f7b16e99838454dd18b1e9cc8620350,"Can you please dig out the details and proof of election fraud? If it exists, the American people should know and act on it.",0,0,0,0,0,0,"Can you please dig out the details and proof of election fraud? If it exists, the American people should know and act on it."
eng_d892ba64eae471c90fbf66a7ba4e3e72,Xenophobia wont trend today. Malawi,0,0,0,0,0,0,Xenophobia wont trend today. Malawi
eng_c07b1b077efe715fb846d66a4ae25a73,"When it comes to research on multiculturalism, what do you think quantitative research would work or qualitative",0,0,0,0,0,0,"When it comes to research on multiculturalism, what do you think quantitative research would work or qualitative"
eng_8dce6169e5af4905f06742e388a3a43f,Kamala Harris is Fave Andetson Palmets sister,0,0,0,0,0,0,Kamala Harris is Fave Andetson Palmets sister
eng_c39ae8ec15297d3528d8c2a5dd7e2753,"""No to ethnic cleansing"". QudsDay QudsMainIssue",0,0,0,0,0,0,"""No to ethnic cleansing"". QudsDay QudsMainIssue"
eng_5e3d50ea89a4aa8d59e2895f0b7c551b,Kamala Harris smoking Russia with,0,1,0,1,0,1,Kamala Harris smoking Russia with
eng_abf4d40839816e0abe3f44e7ee75fe6e,"Its basically ""inspiration theft"" but with a side helping of xenophobia",1,1,1,1,0,1,"Its basically ""inspiration theft"" but with a side helping of MASKED_TOKEN"
eng_6d923c74ac811c7af8dbf5aa0d6f0fe2,Fun fact voted with PedoPrez to eliminate all southern border security.,0,1,1,1,0,0,Fun fact voted with PedoPrez to eliminate all southern border security.
eng_5c0e3afe3297cc60d0be18d7bf694938,"Keep the pressure up, we can do more in military aid we just have a slow government.",0,0,0,0,0,0,"MASKED_TOKEN the pressure up, we can do more in military aid we just have a slow government."
eng_884d49c972a29d59c4632c174cfd7863,Democrats take control of Chesterfield County,0,0,0,0,0,0,Democrats take control of Chesterfield County
eng_0c03f1d0711f597e150188ac9ac2e122,Whats the Gaza Strip of Los angeles??,0,0,0,0,0,0,Whats the Gaza Strip of Los angeles??
eng_fda4754de8d17eec024caf34cacedc0c,Florida seeks mandatory death sentences in immigration bill. Will courts allow it? url@URL,0,0,0,0,0,0,Florida seeks mandatory death sentences in immigration bill. Will courts allow it? url@URL
eng_01472ef28fd3a3408d6de1baa0c935f7,"There is no ""good racism"". There is no ""good xenophobia"". There is racism There is xenophobia And those evil peoples traits dont discriminate.",0,0,0,0,0,0,"There is no ""good racism"". There is no ""good xenophobia"". There is MASKED_TOKEN There is MASKED_TOKEN And those evil peoples traits dont discriminate."
eng_c7373f079e51a14615cc95f52c9c4678,Recognizing fake news now a required subject,0,0,0,0,0,0,Recognizing fake news now a required subject
eng_e9605c10d6de199971f9ee4efba4ca9b,"Meanwhile, Gaza was judenrein for a full generation. But do go on about ""ethnic cleansing"".",1,1,0,1,0,1,"Meanwhile, Gaza was judenrein for a full generation. But do go on about ""MASKED_TOKEN""."
eng_cb4660d5f27bbb11251540e0a3518ac6,opposing Israeli apartheid is not antisemitic,0,1,1,1,1,1,opposing Israeli apartheid is not antisemitic
eng_f961a6ddd9c1aca9456e732292144bef,"There are over 70M of us who voted for decency, harmony, multiculturalism. We live in times of evil depravity. I fear things wont end well.",1,1,0,1,0,0,"There are over 70M of us who voted for decency, harmony, multiculturalism. We live in MASKED_TOKEN of evil depravity. I fear things wont end well."
eng_74c0d771448c695890dc402dfaa4caa7,Wake professor resigns after HamasIsrael social media postWinstonSalem,0,0,0,0,0,0,Wake professor resigns after HamasIsrael social media postWinstonSalem
eng_345fec2f8ec08fe3dea14c1bbe9ead15,"Its called NotInventedHere syndrome. in other words, the technical form of xenophobia",1,0,0,1,0,1,"Its called NotInventedHere syndrome. in other words, the technical form of xenophobia"
eng_8098c67f7eaac68b027ca048af4f888e,"Local reps Duarte, McClintock vote for impeachment",0,0,0,0,0,0,"Local reps Duarte, McClintock vote for impeachment"
eng_4e0a716ea0b0939693a374ac5513241c,"A TV News Reporter on IsraelHamas Fog of War, Truth",0,0,0,0,0,0,"A TV News Reporter on IsraelHamas Fog of War, Truth"
eng_c5adf791567bdf004638c9b594893d3b,Pandemic fatigue translates to CTV are the enemy of the people,0,0,0,0,0,0,Pandemic fatigue translates to CTV are the enemy of the people
eng_113734445f66468f9bbc39dc88d269c9,I just know Kamala Harris be squirting.,0,0,0,0,0,0,I just know Kamala Harris be squirting.
eng_3fc43dd4b9167601333c4749aa5a8f19,"Are you daft? WTF do think an apartheid baby who supports AfD and Trumpism meant by that? ""Hey! There goes Elvia?""",0,1,0,0,0,0,"Are you daft? WTF do think an MASKED_TOKEN baby who supports AfD and MASKED_TOKEN meant by that? ""Hey! There goes Elvia?"""
eng_3e77b15891dc92662fd829633005bc1d,CNN turned to CNN very quickly.,0,0,0,0,0,0,CNN turned to CNN very quickly.
eng_3e0a611408e56ad364ad14a09b695cdc,Topeka Democrat hopes to oust GOP Rep. Jake LaTurner,0,0,0,0,0,0,Topeka Democrat hopes to oust GOP Rep. Jake LaTurner
eng_9b3e962b13b6424c6d33a0d5776c0bad,Stories from Refugees Who Found Their Home,0,0,0,0,0,0,Stories from Refugees Who Found Their Home
eng_c70dceed54c28b7fcb06432724652705,Finally fox news helping expose criminals live on the air.,0,0,0,0,0,0,Finally fox news helping expose criminals live on the air.
eng_454f9afd3b4bd2b22fc907d536173536,Jack Smith took his case against Donald Trump straight to the Supreme Court. Here‚Äôs what that means.,0,0,0,0,0,0,Jack Smith took his case against Donald Trump straight to the Supreme Court. Here‚Äôs what that means.
eng_24677d28914dbd436c91eba0978dc0e0,Exactly! Not just refugees from Europe either. Refugees Ukraina Europe,0,0,0,0,0,0,Exactly! Not just refugees from Europe either. Refugees Ukraina Europe
eng_9382e300a0d0effef881f901d7c6506e,SCOTUS Will Ultimately Decide The Fate Of Donald Trump,0,0,0,0,0,0,SCOTUS Will Ultimately Decide The Fate Of Donald Trump
eng_839cdaa5d74fa141e68bee8be202073a,Are asylum seekers illegal immigrants? Just curious,0,0,0,0,0,0,Are asylum seekers illegal immigrants? Just curious
eng_a3fcf05fbd7d50b5f340b698c3ff76e1,Students called to walkout for ceasefire in Gaza,0,0,0,0,0,0,Students called to walkout for ceasefire in Gaza
eng_d6d89e20c9524410032e637bea7dc706,Hamas Sought to Reach West Bank During October 7 Attack,0,0,0,0,0,0,Hamas Sought to Reach West Bank During October 7 Attack
eng_81d71e725238d6b112125bce8046ced9,Early Voting for the Tennessee primary opens tomorrow July 15th!,0,0,0,0,0,0,Early Voting for the Tennessee primary opens tomorrow July 15th!
eng_ae06b3d099b275682c09159c8e45745f,I need some immigration clients,0,0,0,0,0,0,I need some immigration clients
eng_0db6656ea02920fe236fd7f0f66db198,Socialism is when LGBTQ rights,0,0,0,0,0,0,Socialism is when LGBTQ rights
eng_de0339bf82511a25c4181e9e68dd7d2a,What time does GOP presidential debate,0,0,0,0,0,0,What time does GOP presidential debate
eng_2826b9dc01939dda8124a2babc0a48e2,So far there have been 40 confirmed civilian casualties. Fucking governments just love murdering innocent kids,0,1,1,1,0,0,So far there have been 40 confirmed civilian casualties. Fucking governments just love murdering innocent kids
eng_74a30899f82f32e8d85ad969fd082ab3,"Still no sign of the word ""imperialism"" from CNN.",0,0,0,0,0,0,"Still no sign of the word ""imperialism"" from CNN."
eng_3e78571fe1f474f8539bf85f8d8cab68,"GeNdEr iDeOLoGy, the radical idea that women are people",1,0,0,1,0,0,"GeNdEr iDeOLoGy, the radical idea that women are people"
eng_1891d20a6b80aec03c17988c2e661114,what is the extreme right? link please,0,0,0,0,0,0,what is the extreme right? link please
eng_3b18766a737c9d0a190a43dec155ec22,A woke mob created the conditions and founded this country.,1,1,1,1,0,0,A MASKED_TOKEN created the conditions and founded this country.
eng_6e214ea8e214af8cfb2f331b7be5a8bd,What issues are most important to likely GOP,0,0,0,0,0,0,What issues are most important to likely GOP
eng_707ac1c069e2313dc77730248cf0fad5,Teetering between socialist zealot union agent and psychologist as future career choices,0,0,0,0,0,0,Teetering between socialist zealot union agent and psychologist as future career choices
eng_1f88a3cdadaebea347d3aab2e6ef388a,and a hangar with US military aid paid for by US taxpayers,0,0,0,0,0,0,and a hangar with US military aid paid for by US taxpayers
eng_ced9ce5e7c9075f9e3cd197c22af2ce3,UK SANCTIONS TARGET 20 SHIPS UNDER RUSSIA SANCTIONS REGIME,0,0,0,0,0,0,UK SANCTIONS TARGET 20 SHIPS UNDER RUSSIA SANCTIONS REGIME
eng_5288c08a190e5c04022c0f8e0476b457,NC House Republicans unite behind Destin Hall as next,0,0,0,0,0,0,NC House Republicans unite behind Destin Hall as next
eng_46cb50f8408c4d3d51cddfa16151dd87,He would have stood up to frump and not allowed him to take office because of his insurrection,0,1,1,1,0,0,He would have stood up to frump and not allowed him to take office because of his insurrection
eng_c82f66a7b6ac51c3ad72171ffb21942e,Trumpism is a mental illness seek help,1,1,1,0,1,0,MASKED_TOKEN is a mental illness seek help
eng_448283da07183a293b30a554e8bcd684,I thought we were suppose to defund the police ?,0,0,0,0,0,0,I thought we were suppose to defund the police ?
eng_a90fceb305117a61ff36d6d1875e11c8,Social justice warriors trying to take income away from a person of color. Sounds about right.,1,1,1,0,1,0,Social justice warriors trying MASKED_TOKEN income away from a person of color. Sounds about right.
eng_3526ef39bd3563a8cf487f70eeba3aea,"Because the west isnt going to send military aid, which is what they really want.",0,0,0,0,0,0,"MASKED_TOKEN the west isnt going to send military aid, which is what they really want."
eng_1c284172142f363d68a16aee2ef4ed46,"Tom Suozzi, Democrats pick to replace George Santos",0,0,0,0,0,0,"Tom Suozzi, Democrats pick to replace George Santos"
eng_491bc41fc851528468b3afc9a4265d48,Republicans apparently agree Trump should be,0,0,0,0,0,0,Republicans apparently agree Trump MASKED_TOKEN
eng_68fcf14348985a3646251401a4484926,Remember when TFG was impeached for withholding military aid to Ukraine? We remember.,0,0,0,0,0,0,Remember when TFG was impeached for withholding military aid to Ukraine? We remember.
eng_7befa2d6768cdda2a86eed27feea56e6,Newly Promoted Detective Sergeant for Marinette Police Department,0,0,0,0,0,0,Newly Promoted Detective Sergeant for Marinette Police Department
eng_87ae7278ad9d0868652bf6256b89deb1,"Redneck firing guns into the sky, with accompanying civilian casualties from either stray bullets or people can be utterly stupid",0,0,0,0,0,0,"Redneck firing guns into the sky, with accompanying civilian casualties from either stray bullets or people can be utterly stupid"
eng_594b46d5f06b250a6791db67e02f51a0,voter registration drive happening in 5 different locations today! no excuses!!!,0,0,0,0,0,0,voter registration drive happening in 5 different locations today! no excuses!!!
eng_bc6c8f1829d11d92d0ee042afd3567b2,"How about 50,000 and the rest of them be 37,00 Border security Guards?? !!",0,0,0,0,0,0,"How about 50,000 and the rest of them be 37,00 Border security Guards?? !!"
eng_67bad6a0c8a816ae7c916773055cf8ff,Mike Pence is NO hero!,0,0,0,0,0,0,Mike Pence is NO hero!
eng_70aeeda19598884d763d79a2ae2dbf74,"Defund the police, fund the potholes",0,1,0,1,0,1,"MASKED_TOKEN police, fund the potholes"
eng_031dd22664cf4901508102ca533fc481,MSMedia is the enemy of the PEOPLE!!!!!!,1,1,0,1,0,1,MSMedia is the MASKED_TOKEN of the PEOPLE!!!!!!
eng_27247488d4b4c5932a65b927d564899b,Gary Johnson has a thicc boner for Kamala Harris,1,0,0,1,0,0,Gary Johnson has a thicc boner for Kamala Harris
eng_0d836af05f392d3bee40bdf6aae2399a,"Just remember, there is hard evidence that Russian election interference gave the GOP the majority in the FL legislature",0,0,0,0,0,1,"Just remember, there is hard evidence that Russian election interference gave the GOP the majority in the FL legislature"
eng_0a031568267e73678a60ba981a0c278a,"Daley, a supplemented with chemically synthesized taurine and other voter registration measures that",0,0,0,0,0,0,"Daley, a supplemented with chemically synthesized taurine and other voter registration measures that"
eng_abd7a7c716b3ad994836d38b76cbfe5e,Prejudices like... BLM? Free Palestine? Trans Rights? Why are those bad things?,0,0,0,0,0,0,Prejudices like... BLM? Free Palestine? Trans Rights? Why are those bad things?
eng_fa8e06beb55333f027753466c2eaa4e5,Nigeria Situation Report 4 November 2024 Refugees,0,0,0,0,0,0,Nigeria Situation Report 4 November 2024 Refugees
eng_83da7e628a2cd7e8f855d17b1b48f404,voted on multiple accounts call that voter fraud,0,0,0,0,0,0,voted on multiple accounts call that voter fraud
eng_114c1cce93342b059e94298349b08a07,OMFG! They are children. Fascist babies.,0,1,1,1,1,0,OMFG! They are MASKED_TOKEN. Fascist babies.
eng_0d7b9ccf09f166a64b7ef04752269306,"""People need to know what this war really looks like"" Israeli soldiers who served in Gaza describe indiscriminate killing and the routine classification of civilian casualties as terrorists in conversations with Haaretz",0,1,1,1,0,0,"""People need to know what this war really looks like"" Israeli soldiers who served in Gaza describe indiscriminate killing and the routine classification of civilian casualties as terrorists in conversations with Haaretz"
eng_ba5ace48416d4b4d04cd388eeaf0688a,"Es ist unfassbar wie Spahn sich in Richtung fake news und Trumpismus bewegt, natürlich nicht allein. Einfach ekelhaft.",0,0,0,0,0,0,"Es ist unfassbar wie Spahn sich in Richtung fake news und Trumpismus bewegt, natürlich nicht allein. Einfach ekelhaft."
eng_cc5e3ab1cf65a47769fb2eda918672f1,Do you think the United States should have open borders?,0,0,0,0,0,0,Do you think the United States should have open borders?
eng_e39ccffa54dc51f4a82e521eadb88105,I remember when AOC supported antisemitic Jamal Bowman. I remember when AOC voted against purely defensive Iron Dome.,0,0,0,0,0,0,I remember when AOC supported antisemitic Jamal Bowman. I remember when AOC voted against purely defensive Iron Dome.
eng_5079f54d768179b0297bc4f4bc0a8f8c,"It is Trumpism, so basically, yeah.",0,0,0,0,0,0,"It is MASKED_TOKEN, so basically, yeah."
eng_93112d0c8d5ba7c30fd31e0056329a72,Bryan Smith elected as Idaho GOP,0,0,0,0,0,0,Bryan Smith elected as Idaho GOP
eng_9fd197da2fe29b7c0101c5eaa26c88ae,A Salute to Service: Christian County Honors Veterans,0,0,0,0,0,0,A Salute to Service: Christian County Honors Veterans
eng_019eeba83eed7fcfb2b7db4a27d07233,Who gave the order to stop counting the votes in the swing states?,0,0,0,0,0,0,Who gave the order to stop counting the votes in the swing states?
eng_23c40f7b3ee237c1ac981d5b45ef28be,Kentucky State Police Investigate Fatal Crash in Adair County,0,0,0,0,0,0,Kentucky State Police Investigate Fatal Crash in Adair County
eng_e869eecb43b73e596017ec30fbaa3880,Angel Island exhibit explores disenfranchisement of Chinese,0,0,0,0,0,0,Angel Island exhibit explores disenfranchisement of Chinese
eng_33b9edeaa124f3d8a12f8865d6d5846a,War crimes? Count me in,0,0,0,0,0,0,War crimes? Count me in
eng_c2812ab7c2c687efa3ff25b1088d5e4d,UW system workers to receive 6 pay raises after GOP,0,0,0,0,0,0,UW system workers to receive 6 pay raises after GOP
eng_d419fddf15a9036883846bc1bef5a2fe,Let MAGA red states feel the repercussions for their stupidity and treachery.,0,1,0,0,1,0,MASKED_TOKEN MAGA red states feel the repercussions for their stupidity and treachery.
eng_ed7f304fd309cc29dc4409ce4f57b8fb,Thats a great deportation plan!,0,0,0,0,0,0,Thats a great deportation plan!
eng_c718a99f03330507eb91918f91e2eaf1,feministsky feminism liberalsky resist notgoingback fuckcapitalism capitalism,0,1,1,1,1,0,feministsky feminism liberalsky resist notgoingback fuckcapitalism capitalism
eng_4bf3e6136bde6546ef820149a06ee25a,Tulsa GOP trainwreck disputes multiplyingTulsa Today,0,0,0,0,0,0,Tulsa GOP trainwreck disputes multiplyingTulsa Today
eng_2f9fff6721a858a16dd0749e7c4a7c0d,Youth voter registration has officially surpassed 2018 numbers in Texas.,0,0,0,0,0,0,Youth voter registration has officially surpassed 2018 numbers in Texas.
eng_27202013a391bca8668cdc48c68ed21f,Cop Talk Featuring Bay City Police Detective Chris Scheduled,0,0,0,0,0,0,Cop Talk Featuring Bay City Police Detective Chris Scheduled
eng_d5a2fea439efacd4f3d8007f38206225,how is this not the election fraud ?,0,0,0,0,0,0,how is this not MASKED_TOKEN fraud ?
eng_94e41951dc909636d7c03e32d52239f0,"""Hamas, Hamas, jude on the gas""",0,1,0,1,1,0,"""Hamas, Hamas, jude on the gas"""
eng_f2777b9309fd39571a060c9232244265,House District 2 runoff is a GOP family feud,0,0,0,0,0,0,House District 2 runoff is a GOP family feud
eng_ad9d809bb0581131e40131131cbaddcd,stanning Zelensky is liberal cringe,0,1,0,0,1,0,stanning Zelensky is liberal cringe
eng_9c06308e8eb40608fd3902364694257f,Hes lying. Theyre trying to control the narrative. This documents zionists in the West bank.,0,1,1,1,0,1,MASKED_TOKEN lying. Theyre trying to control the narrative. This documents zionists in the West bank.
eng_4f0b20acb03f0590a95d778daaaaddbf,Didnt black women overwhelmingly support Kamala Harris?,0,0,0,0,0,0,Didnt black women overwhelmingly support Kamala Harris?
eng_24bfaa3408a0fbee17c8405d12757235,Posting a pic of a dozen neonazis at a rally to justify the annexation and denazification of New Zealand,0,0,0,0,0,0,Posting a pic of a dozen neonazis at a rally to justify the annexation and denazification of New Zealand
eng_f3c0e7d8034aca2b8c70c13bd426eb34,Counterpoint American Arabs voted for trumps plan for Israel to Annex Gaza and the West Bank.,1,1,0,0,1,0,Counterpoint American Arabs voted for trumps plan for Israel to Annex Gaza and the West Bank.
eng_0aaf2266b36d41d5ac97c499d4106557,"Netherlands pledges 2025 military aid to Ukraine, including air defenses, tanks, and artillery",0,0,0,0,0,0,"Netherlands pledges 2025 military aid to Ukraine, including air defenses, tanks, and artillery"
eng_050a07019aca85b263b327eef4c7e3cd,"Russias latest claims are classic psychological warfare. France was right to respond firmly Russian aggression must end, and any peace talks must fully include Ukraine. No backdoor deals with the aggressor. StandWithUkraine @URL",1,0,1,1,0,0,"Russias latest claims are classic psychological warfare. France was right to respond firmly Russian aggression must end, and any peace talks must fully include Ukraine. No backdoor deals with the aggressor. StandWithUkraine @URL"
eng_478e6ad93fd80a5c73b5ef40b414a46b,"Seattle Office for Civil Rights memo says Seattle PD weapons can amount to ""collective punishment""",0,0,0,0,0,0,"Seattle Office for Civil Rights memo says Seattle PD weapons can amount to ""collective punishment"""
eng_1cfdf8660f9b5877f8038470a6bc6f7b,VP Kamala Harris makes history with Senate,0,0,0,0,0,0,VP Kamala Harris makes history with Senate
eng_23cb1412b3d854b32ba0d0cb6652129a,Get the impeachment charges ready.,0,0,0,0,0,0,Get the impeachment charges ready.
eng_833fe29fc816c3c3a4ee77f3bdc3b4f3,Trump literally wanted Mike Pence dead,0,1,0,1,1,1,Trump literally wanted Mike Pence dead
eng_638c2bc2c79447b16d871aa31f811ed1,BREAKING Voter registration continues! Please go get your PVC!!,0,0,0,0,0,0,BREAKING Voter registration continues! Please go get your PVC!!
eng_01bd301adaac4183f149a178ef587944,indict unrest martial law no more electoral college !,0,0,0,1,0,1,indict unrest martial law no more electoral college !
eng_823f697d1f5af5a6940e7d5412371971,"US may not be able to send remaining 5.6bn in military aid to Ukraine before Trump takes office, NYT reports.",0,0,0,0,0,0,"US may not be able to send remaining 5.6bn in military aid to Ukraine before Trump takes office, NYT reports."
eng_c19215e6c76d4986cb7a6c3fba9b3d57,Should we abolish the electoral college,0,0,0,0,0,0,Should we abolish the electoral college
eng_ca630cc29fa116b0d4e4b05510a38357,Ramlawi is trying to score points with breitbart readers or what? a2council,0,1,0,1,1,0,Ramlawi is trying to score points with breitbart readers or what? a2council
eng_c1e7e3a9de2b48cdbe7a88277786f079,Rise of AI fake news is creating a misinformation,0,0,0,0,0,0,Rise of AI fake news is creating a misinformation
eng_bfbd1a80a50d1cda2abc5597dd721d53,"Yes, instead of changing course and embracing actual progressive policies, please follow a no longer relevant playbook.",0,1,0,1,0,1,"Yes, instead of changing course and embracing actual progressive policies, please follow a no longer relevant playbook."
eng_9f221acc0d0e47a623011cd8eaa15ce2,Magistrate to preside over Donald Trump court,0,0,0,0,0,0,Magistrate to preside over Donald Trump court
eng_15c41ae2892c8b61228b379a2f6c599d,"Death toll in stifling Texas prisons climbs, Democrats seek",0,0,0,0,0,0,"Death toll in stifling Texas prisons climbs, Democrats seek"
eng_ed294e013eff77df753c6aa313a2df90,"Lets not normalize imperialism. This is a sideeffect, in part, as too many Western academics ""media"" normalize Russian aggression. authoritarianism imperialism colonialism",0,0,0,0,0,0,"Lets not normalize imperialism. This is a sideeffect, in part, as too many Western academics ""media"" normalize Russian aggression. authoritarianism imperialism colonialism"
eng_534c044c56e7c7d492e578f0fd0aa2b5,Yes! Check your open borders for the outbreaks.,0,0,0,0,0,0,Yes! Check your open borders for the outbreaks.
eng_17aaccf76e6d7cbec11b81102ea13668,Tulsi Gabbard to headline Mahoning GOP,0,0,0,0,0,0,Tulsi Gabbard to headline Mahoning GOP
eng_d821455627f4c12226a1287d65dc3565,ElonMusk Citizenship Biden Immigration Deportation Politics Polymarket,0,0,0,0,0,0,ElonMusk Citizenship Biden Immigration Deportation Politics Polymarket
eng_5ecf13a7c760c44f42a435394d7eff39,Hmm and yet we are on the eve of returning an insurrection back to power. Wtf?!! Im embarrassed to be white.,1,0,0,1,1,1,Hmm and yet we are on the eve of returning an insurrection back to power. Wtf?!! Im embarrassed to be MASKED_TOKEN.
eng_c0ebba86ac4f902868f43e9e292818ea,Viewing IsraelHamas war through the lens of history,0,0,0,0,0,0,Viewing IsraelHamas war through the lens of history
eng_0c6d5f540929361a0044ba4999e5cc37,Thats because only the USA has a second amendment!,0,0,0,0,0,0,Thats MASKED_TOKEN only the USA has a second amendment!
eng_f06df8a1d616a47914fb68ce5e639b42,"The IDF....Proud defenders of Apartheid, murderers of Palestinian children",0,1,1,1,1,0,"The IDF....Proud defenders of Apartheid, murderers of Palestinian MASKED_TOKEN"
eng_1bb55800bc81bb04aa1d39e966330a75,That is not right Donald Trump,0,0,0,0,0,0,That is not right Donald Trump
eng_eaf6fa0340c41ab8d976f7e3353c445c,When are the Truckers going to the southern boarder and stop illegal immigration?,1,0,0,1,1,1,When MASKED_TOKEN Truckers going to the southern boarder and stop illegal immigration?
eng_438d26e961192bec14f605713117cec4,U.S. Rep. Summer Lee joins resolution calling for ceasefire,0,0,0,0,0,0,U.S. Rep. Summer Lee joins resolution calling for ceasefire
eng_4d6df51fbe5d7cd81109729d422c2de6,MVP Kamala Harris. Thats the tweet. MVPinMunich MVPKamalaHarris,0,0,0,0,0,0,MVP Kamala Harris. Thats the tweet. MVPinMunich MVPKamalaHarris
eng_53e4630566693fbb681484f4be900c09,impeachment starting yet ? Lets get on with it . All the republicans need to go. They are all compromised,1,1,0,1,0,0,impeachment starting yet ? Lets get on with it . All the republicans need to go. They are all compromised
eng_2af84924efce0a99f76c1f1734e49bb5,Please support Ukraine Stop Russian aggression,0,0,0,0,0,0,Please support Ukraine Stop Russian aggression
